<!ELEMENT inventario (producto+)>
<!ELEMENT producto (nombre,precio,stock,categoria,seguro)>
<!ELEMENT nombre (#PCDATA)>
<!ELEMENT precio (#PCDATA)>
<!ELEMENT stock (#PCDATA)>
<!ELEMENT categoria (#PCDATA)>
<!ELEMENT seguro (#PCDATA)>